{
  "branch": "fix/final-evaluation-compliance",
  "cases": [
    {
      "expected": {
        "complete": true,
        "conflict_signaled": false,
        "fallback": false,
        "grounded": false,
        "iterations": 1,
        "schema": true,
        "tool_correct": true,
        "valid": true
      },
      "id": "few-shot-off",
      "obtained": {
        "complete": true,
        "conflict_signaled": false,
        "fallback": false,
        "grounded": false,
        "iterations": 1,
        "schema": true,
        "tool_correct": true,
        "valid": true
      },
      "scenario": "few_shot",
      "variant": "without"
    },
    {
      "expected": {
        "complete": true,
        "conflict_signaled": false,
        "fallback": false,
        "grounded": true,
        "iterations": 1,
        "schema": true,
        "tool_correct": true,
        "valid": true
      },
      "id": "few-shot-on",
      "obtained": {
        "complete": true,
        "conflict_signaled": false,
        "fallback": false,
        "grounded": true,
        "iterations": 1,
        "schema": true,
        "tool_correct": true,
        "valid": true
      },
      "scenario": "few_shot",
      "variant": "with"
    },
    {
      "expected": {
        "complete": true,
        "conflict_signaled": false,
        "fallback": false,
        "grounded": true,
        "iterations": 1,
        "schema": false,
        "tool_correct": true,
        "valid": true
      },
      "id": "schema-off",
      "obtained": {
        "complete": true,
        "conflict_signaled": false,
        "fallback": false,
        "grounded": true,
        "iterations": 1,
        "schema": false,
        "tool_correct": true,
        "valid": true
      },
      "scenario": "schema",
      "variant": "without"
    },
    {
      "expected": {
        "complete": true,
        "conflict_signaled": false,
        "fallback": false,
        "grounded": true,
        "iterations": 1,
        "schema": true,
        "tool_correct": true,
        "valid": true
      },
      "id": "schema-on",
      "obtained": {
        "complete": true,
        "conflict_signaled": false,
        "fallback": false,
        "grounded": true,
        "iterations": 1,
        "schema": true,
        "tool_correct": true,
        "valid": true
      },
      "scenario": "schema",
      "variant": "with"
    },
    {
      "expected": {
        "complete": false,
        "conflict_signaled": false,
        "fallback": false,
        "grounded": false,
        "iterations": 1,
        "schema": true,
        "tool_correct": true,
        "valid": true
      },
      "id": "tool-off",
      "obtained": {
        "complete": false,
        "conflict_signaled": false,
        "fallback": false,
        "grounded": false,
        "iterations": 1,
        "schema": true,
        "tool_correct": true,
        "valid": true
      },
      "scenario": "tool_usage",
      "variant": "without"
    },
    {
      "expected": {
        "complete": true,
        "conflict_signaled": false,
        "fallback": false,
        "grounded": true,
        "iterations": 2,
        "schema": true,
        "tool_correct": true,
        "valid": true
      },
      "id": "tool-on",
      "obtained": {
        "complete": true,
        "conflict_signaled": false,
        "fallback": false,
        "grounded": true,
        "iterations": 2,
        "schema": true,
        "tool_correct": true,
        "valid": true
      },
      "scenario": "tool_usage",
      "variant": "with"
    },
    {
      "expected": {
        "complete": true,
        "conflict_signaled": false,
        "fallback": false,
        "grounded": true,
        "iterations": 2,
        "schema": true,
        "tool_correct": true,
        "valid": true
      },
      "id": "one-tool",
      "obtained": {
        "complete": true,
        "conflict_signaled": false,
        "fallback": false,
        "grounded": true,
        "iterations": 2,
        "schema": true,
        "tool_correct": true,
        "valid": true
      },
      "scenario": "tool_sequence",
      "variant": "one"
    },
    {
      "expected": {
        "complete": true,
        "conflict_signaled": false,
        "fallback": false,
        "grounded": true,
        "iterations": 3,
        "schema": true,
        "tool_correct": true,
        "valid": true
      },
      "id": "two-tools",
      "obtained": {
        "complete": true,
        "conflict_signaled": false,
        "fallback": false,
        "grounded": true,
        "iterations": 3,
        "schema": true,
        "tool_correct": true,
        "valid": true
      },
      "scenario": "tool_sequence",
      "variant": "two_sequential"
    },
    {
      "expected": {
        "complete": false,
        "conflict_signaled": false,
        "fallback": true,
        "grounded": true,
        "iterations": 1,
        "schema": true,
        "tool_correct": true,
        "valid": true
      },
      "id": "evidence-insufficient",
      "obtained": {
        "complete": false,
        "conflict_signaled": false,
        "fallback": true,
        "grounded": true,
        "iterations": 1,
        "schema": true,
        "tool_correct": true,
        "valid": true
      },
      "scenario": "evidence",
      "variant": "insufficient"
    },
    {
      "expected": {
        "complete": true,
        "conflict_signaled": false,
        "fallback": false,
        "grounded": true,
        "iterations": 1,
        "schema": true,
        "tool_correct": true,
        "valid": true
      },
      "id": "evidence-sufficient",
      "obtained": {
        "complete": true,
        "conflict_signaled": false,
        "fallback": false,
        "grounded": true,
        "iterations": 1,
        "schema": true,
        "tool_correct": true,
        "valid": true
      },
      "scenario": "evidence",
      "variant": "sufficient"
    },
    {
      "expected": {
        "complete": true,
        "conflict_signaled": false,
        "fallback": false,
        "grounded": true,
        "iterations": 1,
        "schema": true,
        "tool_correct": true,
        "valid": true
      },
      "id": "response-normal",
      "obtained": {
        "complete": true,
        "conflict_signaled": false,
        "fallback": false,
        "grounded": true,
        "iterations": 1,
        "schema": true,
        "tool_correct": true,
        "valid": true
      },
      "scenario": "timeout",
      "variant": "normal"
    },
    {
      "expected": {
        "complete": true,
        "conflict_signaled": false,
        "fallback": true,
        "grounded": true,
        "iterations": 1,
        "schema": true,
        "tool_correct": true,
        "valid": true
      },
      "id": "response-timeout",
      "obtained": {
        "complete": true,
        "conflict_signaled": false,
        "fallback": true,
        "grounded": true,
        "iterations": 1,
        "schema": true,
        "tool_correct": true,
        "valid": true
      },
      "scenario": "timeout",
      "variant": "timeout"
    },
    {
      "expected": {
        "complete": true,
        "conflict_signaled": false,
        "fallback": true,
        "grounded": true,
        "iterations": 1,
        "schema": true,
        "tool_correct": true,
        "valid": true
      },
      "id": "local-fallback",
      "obtained": {
        "complete": true,
        "conflict_signaled": false,
        "fallback": true,
        "grounded": true,
        "iterations": 1,
        "schema": true,
        "tool_correct": true,
        "valid": true
      },
      "scenario": "engine",
      "variant": "local"
    },
    {
      "expected": {
        "complete": true,
        "conflict_signaled": false,
        "fallback": false,
        "grounded": true,
        "iterations": 1,
        "schema": true,
        "tool_correct": true,
        "valid": true
      },
      "id": "mock-model",
      "obtained": {
        "complete": true,
        "conflict_signaled": false,
        "fallback": false,
        "grounded": true,
        "iterations": 1,
        "schema": true,
        "tool_correct": true,
        "valid": true
      },
      "scenario": "engine",
      "variant": "mock"
    },
    {
      "expected": {
        "complete": true,
        "conflict_signaled": false,
        "fallback": false,
        "grounded": true,
        "iterations": 1,
        "schema": true,
        "tool_correct": true,
        "valid": true
      },
      "id": "config-conservative",
      "obtained": {
        "complete": true,
        "conflict_signaled": false,
        "fallback": false,
        "grounded": true,
        "iterations": 1,
        "schema": true,
        "tool_correct": true,
        "valid": true
      },
      "scenario": "configuration",
      "variant": "conservative"
    },
    {
      "expected": {
        "complete": true,
        "conflict_signaled": false,
        "fallback": false,
        "grounded": false,
        "iterations": 1,
        "schema": true,
        "tool_correct": true,
        "valid": true
      },
      "id": "config-creative",
      "obtained": {
        "complete": true,
        "conflict_signaled": false,
        "fallback": false,
        "grounded": false,
        "iterations": 1,
        "schema": true,
        "tool_correct": true,
        "valid": true
      },
      "scenario": "configuration",
      "variant": "creative"
    },
    {
      "expected": {
        "complete": true,
        "conflict_signaled": false,
        "fallback": false,
        "grounded": true,
        "iterations": 2,
        "schema": true,
        "tool_correct": true,
        "valid": true
      },
      "id": "tool-valid",
      "obtained": {
        "complete": true,
        "conflict_signaled": false,
        "fallback": false,
        "grounded": true,
        "iterations": 2,
        "schema": true,
        "tool_correct": true,